{
  "id": "bodyweight_squat",
  "name": "Bodyweight Squat",
  "version": 2,
  "equipment": [],
  "target_muscles": ["quadriceps", "glutes", "adductors"],
  "camera_views": ["side"],
  "animation": {
    "asset": "squat.glb",
    "clip": "squat",
    "duration_s": 4,
    "phases": [
      {
        "phase": "standing",
        "start_s": 0,
        "end_s": 0.5,
        "instruction_indices": [0]
      },
      {
        "phase": "descending",
        "start_s": 0.5,
        "end_s": 2,
        "instruction_indices": [1]
      },
      {
        "phase": "bottom",
        "start_s": 2,
        "end_s": 2.4,
        "instruction_indices": [2]
      },
      {
        "phase": "ascending",
        "start_s": 2.4,
        "end_s": 3.6,
        "instruction_indices": [3]
      },
      {
        "phase": "standing",
        "start_s": 3.6,
        "end_s": 4,
        "instruction_indices": [0]
      }
    ]
  },
  "supported_capabilities": [
    "pose_tracking",
    "rep_counting",
    "phase_detection",
    "rule_based_feedback"
  ],
  "required_landmarks": ["left_hip", "left_knee", "left_ankle", "left_shoulder"],
  "ruleset_version": 3,
  "phases": ["standing", "descending", "bottom", "ascending"],
  "instructions": [
    "Stand with feet roughly shoulder-width apart, toes slightly turned out.",
    "Sit the hips back and down while keeping your chest up.",
    "Lower until your thighs are about parallel to the floor, or as far as is comfortable.",
    "Push through your whole foot to stand back up."
  ],
  "technique_considerations": [
    "Keep heels on the floor throughout.",
    "Let knees track in line with your toes."
  ]
}
